{"schemaVersion":2,"evidenceKind":"chronorift-project-environment-pe-b-evidence","evidenceProfile":"dynamic-projection-two-session-v2","source":{"sourceKind":"project-environment-v1-clean-git","headCommit":"e415c27e9ad368e4f87718f929bc57140e3abaac","selectedTreeSha256":"eacf2aa3c46da4fd13c470bcb7f3433bfac4bba997929d5021e158df22a7b952","projectSourceIdentity":"cbb9c044633722fa5e0c89e9ea0e7c3490147dc3eafd208dec8b21c3007abeb9","mainScene":"res://main.tscn","requestedGodotVersion":"4.7.1"},"toolchain":{"schemaVersion":1,"receiptId":"toolchain-receipt:v1:7bc728cd799c5645341a08710bc14580b16159f817ce7136327a703519000403","requested":{"schemaVersion":1,"engineFamily":"godot","versionRequirement":"4.7.1","platform":"linux-x86_64","requiredFeatures":["gdscript","headless"]},"status":"realized","realized":{"schemaVersion":1,"engineFamily":"godot","version":"4.7.1","platform":"linux-x86_64","artifactDigest":"32f8d7596c4b41185512b1c49d69f2da3be018fd784a53e349fa92a98a97bcde","features":["gdscript","headless"],"renderer":"gl_compatibility"},"limitations":[],"observedAt":"2026-08-13T21:10:31.298Z"},"adapter":{"candidateSha256":"950c5a307ba7147548800b4219c7d536dd4044c74902c33dc4cf0bf75bc0f3e1","manifestSha256":"ad840a69cb464341834a17388b91179996707c9f0e5d0194681a56cddcfa4744","manifest":{"schemaVersion":2,"manifestKind":"chronorift-project-adapter","adapterId":"adapter.pea.8b839db76d32189d4c655883a4048c87a65d99bdaeb1d0d2","adapterVersion":"2.0.0","sdk":{"id":"chronorift-project-adapter-sdk","version":2},"engine":{"id":"godot","versionRequirement":"4.7.x","language":"gdscript"},"entryScript":"src/project_adapter.gd","schemas":[{"schemaVersion":2,"schemaId":"entity.dynamic-actor","path":"schemas/entity.json","sha256":"9333755d80b4de4641eee83f1da5c358e6509e55e4825addb8aad2e2fe1f55fe"},{"schemaVersion":2,"schemaId":"event.dynamic-actor-level-changed","path":"schemas/event.json","sha256":"4123114f7c58e8eb9c8a99f34d778cd514b83d6136e8dc852cc47fbc3c2f8d80"},{"schemaVersion":2,"schemaId":"launch.params","path":"schemas/launch.params.json","sha256":"fe84c6eac2a84be5989760519912ec5966cf350d4f39e6b032a67e0a21ca2846"},{"schemaVersion":2,"schemaId":"state.dynamic-actor-level","path":"schemas/state.json","sha256":"24f7449b9b0e80bd62af0de4e0279f8ef751e2ffb7cc4547ccd480ab45076927"}],"launchTargets":[{"schemaVersion":2,"targetId":"main","scene":"res://main.tscn","default":true,"parametersSchemaId":"launch.params","renderer":"headless","requiredModules":["lifecycle","clock","runtime_error","entity_projection","state_projection","event_projection","capture"]}],"modules":{"schemaVersion":1,"modules":[{"schemaVersion":1,"module":"lifecycle","status":"implemented","protocolVersion":"project-adapter-module:v2","limitations":[]},{"schemaVersion":1,"module":"clock","status":"implemented","protocolVersion":"project-adapter-module:v2","limitations":[]},{"schemaVersion":1,"module":"runtime_error","status":"implemented","protocolVersion":"project-adapter-module:v2","limitations":[]},{"schemaVersion":1,"module":"entity_projection","status":"implemented","protocolVersion":"project-adapter-module:v2","limitations":[]},{"schemaVersion":1,"module":"state_projection","status":"implemented","protocolVersion":"project-adapter-module:v2","limitations":[]},{"schemaVersion":1,"module":"event_projection","status":"implemented","protocolVersion":"project-adapter-module:v2","limitations":[]},{"schemaVersion":1,"module":"capture","status":"implemented","protocolVersion":"project-adapter-module:v2","limitations":[]},{"schemaVersion":1,"module":"input_control","status":"unsupported","protocolVersion":null,"limitations":["The V2 reference does not implement this optional module."]},{"schemaVersion":1,"module":"snapshot","status":"unsupported","protocolVersion":null,"limitations":["The V2 reference does not implement this optional module."]},{"schemaVersion":1,"module":"restore","status":"unsupported","protocolVersion":null,"limitations":["The V2 reference does not implement this optional module."]},{"schemaVersion":1,"module":"render_capture","status":"unsupported","protocolVersion":null,"limitations":["The V2 reference does not implement this optional module."]},{"schemaVersion":1,"module":"alignment","status":"unsupported","protocolVersion":null,"limitations":["The V2 reference does not implement this optional module."]}]},"entityTypes":[{"schemaVersion":2,"entityTypeId":"dynamic-actor","schemaId":"entity.dynamic-actor","identityStrategy":"spawn_lineage"}],"stateDomains":[{"schemaVersion":2,"stateDomainId":"dynamic-actor-level","schemaId":"state.dynamic-actor-level","checkpointDisposition":"uncontrolled","subject":{"schemaVersion":2,"kind":"entity","allowedEntityTypeIds":["dynamic-actor"]}}],"eventTypes":[{"schemaVersion":2,"eventTypeId":"dynamic-actor-level-changed","schemaId":"event.dynamic-actor-level-changed","source":{"schemaVersion":2,"kind":"entity","allowedEntityTypeIds":["dynamic-actor"]}}],"smoke":{"schemaVersion":2,"targetId":"main","timeoutMs":30000,"minimumStateSamples":4,"minimumEntityLifecycleRecords":3,"requiredStateDomainIds":["dynamic-actor-level"],"requiredCustomEventTypeIds":["dynamic-actor-level-changed"],"requiredDynamicTraces":[{"schemaVersion":2,"traceId":"dynamic-actor-level-trace","entityTypeId":"dynamic-actor","stateDomainId":"dynamic-actor-level","eventTypeId":"dynamic-actor-level-changed","minimumIncarnations":2}]}}},"environment":{"revision":{"schemaVersion":1,"environmentId":"environment:v1:8b839db76d32189d4c655883a4048c87a65d99bdaeb1d0d242d30187d45dda0d","environmentRevisionId":"environment-revision:v1:43801478225fadfeb851cfbf838b331b712f594f3baf51db8268849bc1ffa071","sourceId":"source:v1:cbb9c044633722fa5e0c89e9ea0e7c3490147dc3eafd208dec8b21c3007abeb9","adapterRevisionId":"adapter-revision:v1:950c5a307ba7147548800b4219c7d536dd4044c74902c33dc4cf0bf75bc0f3e1","sdkDigest":"babc7c6e46fa8d243b14088014896a0aace0ed35a3f3038a1d30427aac31b1c6","bridgeDigest":"75991cd1022b27a5a899a4ba1c7467d825f79b52387e73e96994630fe876abcd","toolchainReceiptId":"toolchain-receipt:v1:7bc728cd799c5645341a08710bc14580b16159f817ce7136327a703519000403","conformanceReceiptId":"conformance:v2:af0ee48cfdf19e7fe0dafbab321f4039664f4cc71506d7a2fb8c4e86a6396343","observerEffectReceiptId":"observer:v1:cc5b5a10a7745b8c0fa9185a22844b0f9598a6bc61517ea25937e6e2bf5a7862","policyProfileDigest":"0c9d56624b8db6c7d9bf3312a04881d905d63e05b5953546cb77aae8a99a3efe","publicationOperationId":"publication.v1.b30b0ac9-f431-4e8c-8a71-0f12186260b4","contentDigest":"be26e5279952f335879241b4e3d32e7034f4887d602b0871375e30350bae518f","publishedAt":"2026-08-13T21:15:04.668Z"},"files":[{"path":"adapter/manifest.json","byteLength":5795,"sha256":"ad840a69cb464341834a17388b91179996707c9f0e5d0194681a56cddcfa4744","canonicalBase64":"ewogICJzY2hlbWFWZXJzaW9uIjogMiwKICAibWFuaWZlc3RLaW5kIjogImNocm9ub3JpZnQtcHJvamVjdC1hZGFwdGVyIiwKICAiYWRhcHRlcklkIjogImFkYXB0ZXIucGVhLjhiODM5ZGI3NmQzMjE4OWQ0YzY1NTg4M2E0MDQ4Yzg3YTY1ZDk5YmRhZWIxZDBkMiIsCiAgImFkYXB0ZXJWZXJzaW9uIjogIjIuMC4wIiwKICAic2RrIjogewogICAgImlkIjogImNocm9ub3JpZnQtcHJvamVjdC1hZGFwdGVyLXNkayIsCiAgICAidmVyc2lvbiI6IDIKICB9LAogICJlbmdpbmUiOiB7CiAgICAiaWQiOiAiZ29kb3QiLAogICAgInZlcnNpb25SZXF1aXJlbWVudCI6ICI0LjcueCIsCiAgICAibGFuZ3VhZ2UiOiAiZ2RzY3JpcHQiCiAgfSwKICAiZW50cnlTY3JpcHQiOiAic3JjL3Byb2plY3RfYWRhcHRlci5nZCIsCiAgInNjaGVtYXMiOiBbCiAgICB7CiAgICAgICJzY2hlbWFWZXJzaW9uIjogMiwKICAgICAgInNjaGVtYUlkIjogImVudGl0eS5keW5hbWljLWFjdG9yIiwKICAgICAgInBhdGgiOiAic2NoZW1hcy9lbnRpdHkuanNvbiIsCiAgICAgICJzaGEyNTYiOiAiOTMzMzc1NWQ4MGI0ZGU0NjQxZWVlODNmMWRhNWMzNThlNjUwOWU1NWU0ODI1YWRkYjhhYWQyZTJmZTFmNTVmZSIKICAgIH0sCiAgICB7CiAgICAgICJzY2hlbWFWZXJzaW9uIjogMiwKICAgICAgInNjaGVtYUlkIjogImV2ZW50LmR5bmFtaWMtYWN0b3ItbGV2ZWwtY2hhbmdlZCIsCiAgICAgICJwYXRoIjogInNjaGVtYXMvZXZlbnQuanNvbiIsCiAgICAgICJzaGEyNTYiOiAiNDEyMzExNGY3YzU4ZThlYjljOGE5OWYzNGQ3NzhjZDUxNGI4M2Q2MTM2ZThkYzg1MmNjNDdmYmMzYzJmOGQ4MCIKICAgIH0sCiAgICB7CiAgICAgICJzY2hlbWFWZXJzaW9uIjogMiwKICAgICAgInNjaGVtYUlkIjogImxhdW5jaC5wYXJhbXMiLAogICAgICAicGF0aCI6ICJzY2hlbWFzL2xhdW5jaC5wYXJhbXMuanNvbiIsCiAgICAgICJzaGEyNTYiOiAiZmU4NGM2ZWFjMmE4NGJlNTk4OTc2MDUxOTkxMmVjNTk2NmNmMzUwZDRmMzllNmIwMzJhNjdlMGEyMWNhMjg0NiIKICAgIH0sCiAgICB7CiAgICAgICJzY2hlbWFWZXJzaW9uIjogMiwKICAgICAgInNjaGVtYUlkIjogInN0YXRlLmR5bmFtaWMtYWN0b3ItbGV2ZWwiLAogICAgICAicGF0aCI6ICJzY2hlbWFzL3N0YXRlLmpzb24iLAogICAgICAic2hhMjU2IjogIjI0Zjc0NDliOWIwZTgwYmQ2MmFmMGRlNGUwMjc5ZjhlZjc1MWUyZmZiN2NjNDU0N2NjZDQ4MGFiNDUwNzY5MjciCiAgICB9CiAgXSwKICAibGF1bmNoVGFyZ2V0cyI6IFsKICAgIHsKICAgICAgInNjaGVtYVZlcnNpb24iOiAyLAogICAgICAidGFyZ2V0SWQiOiAibWFpbiIsCiAgICAgICJzY2VuZSI6ICJyZXM6Ly9tYWluLnRzY24iLAogICAgICAiZGVmYXVsdCI6IHRydWUsCiAgICAgICJwYXJhbWV0ZXJzU2NoZW1hSWQiOiAibGF1bmNoLnBhcmFtcyIsCiAgICAgICJyZW5kZXJlciI6ICJoZWFkbGVzcyIsCiAgICAgICJyZXF1aXJlZE1vZHVsZXMiOiBbCiAgICAgICAgImxpZmVjeWNsZSIsCiAgICAgICAgImNsb2NrIiwKICAgICAgICAicnVudGltZV9lcnJvciIsCiAgICAgICAgImVudGl0eV9wcm9qZWN0aW9uIiwKICAgICAgICAic3RhdGVfcHJvamVjdGlvbiIsCiAgICAgICAgImV2ZW50X3Byb2plY3Rpb24iLAogICAgICAgICJjYXB0dXJlIgogICAgICBdCiAgICB9CiAgXSwKICAibW9kdWxlcyI6IHsKICAgICJzY2hlbWFWZXJzaW9uIjogMSwKICAgICJtb2R1bGVzIjogWwogICAgICB7CiAgICAgICAgInNjaGVtYVZlcnNpb24iOiAxLAogICAgICAgICJtb2R1bGUiOiAibGlmZWN5Y2xlIiwKICAgICAgICAic3RhdHVzIjogImltcGxlbWVudGVkIiwKICAgICAgICAicHJvdG9jb2xWZXJzaW9uIjogInByb2plY3QtYWRhcHRlci1tb2R1bGU6djIiLAogICAgICAgICJsaW1pdGF0aW9ucyI6IFtdCiAgICAgIH0sCiAgICAgIHsKICAgICAgICAic2NoZW1hVmVyc2lvbiI6IDEsCiAgICAgICAgIm1vZHVsZSI6ICJjbG9jayIsCiAgICAgICAgInN0YXR1cyI6ICJpbXBsZW1lbnRlZCIsCiAgICAgICAgInByb3RvY29sVmVyc2lvbiI6ICJwcm9qZWN0LWFkYXB0ZXItbW9kdWxlOnYyIiwKICAgICAgICAibGltaXRhdGlvbnMiOiBbXQogICAgICB9LAogICAgICB7CiAgICAgICAgInNjaGVtYVZlcnNpb24iOiAxLAogICAgICAgICJtb2R1bGUiOiAicnVudGltZV9lcnJvciIsCiAgICAgICAgInN0YXR1cyI6ICJpbXBsZW1lbnRlZCIsCiAgICAgICAgInByb3RvY29sVmVyc2lvbiI6ICJwcm9qZWN0LWFkYXB0ZXItbW9kdWxlOnYyIiwKICAgICAgICAibGltaXRhdGlvbnMiOiBbXQogICAgICB9LAogICAgICB7CiAgICAgICAgInNjaGVtYVZlcnNpb24iOiAxLAogICAgICAgICJtb2R1bGUiOiAiZW50aXR5X3Byb2plY3Rpb24iLAogICAgICAgICJzdGF0dXMiOiAiaW1wbGVtZW50ZWQiLAogICAgICAgICJwcm90b2NvbFZlcnNpb24iOiA